{
  "schemaVersion": 4,
  "generatorVersion": "0.5.0",
  "worldId": "windhoof-first-island",
  "seed": 483921,
  "presentation": {
    "mood": "a naturalistic island journey from storm isolation to herd belonging",
    "atmosphere": "clear salt air, readable regional silhouettes, restrained mystery",
    "lighting": "late warm sun with cool sky fill and a bright central crown",
    "palette": [
      "storm-blue",
      "longgrass-gold",
      "fern-green",
      "river-silver",
      "blackstone",
      "high-pasture-green"
    ]
  },
  "island": {
    "sizeMeters": 1024,
    "seaLevelMeters": 0,
    "chunkSizeMeters": 128,
    "terrainSamplesPerEdge": 65
  },
  "spawn": {
    "regionId": "saltwind-coast",
    "clearanceRadiusMeters": 5,
    "maxSlopeDegrees": 8
  },
  "topology": {
    "coastalLoopRegionIds": [
      "saltwind-coast",
      "longgrass-plain",
      "fernwood",
      "river-hollow"
    ],
    "centralHighlandRegionId": "blackstone-crown"
  },
  "regions": [
    {
      "id": "saltwind-coast",
      "role": "storm-beach opening, first tracks, and a forgiving route choice",
      "anchorMeters": { "x": 0, "z": -340 },
      "coverage": 0.18,
      "elevationMeters": [1, 14],
      "moisture": [0.15, 0.65],
      "maxSlopeDegrees": 18,
      "adjacentTo": ["longgrass-plain", "river-hollow"],
      "tags": ["beach", "dunes", "storm", "tracks", "opening"],
      "visualIntent": {
        "terrainFamily": "coastal",
        "silhouette": "split sea stack, wind-bent trees, and a broken beacon",
        "scatterFamilies": ["weathered-rock", "marram", "drift-debris"],
        "scatterDensity": 0.35
      },
      "terrainIntent": {
        "anchorElevationMeters": 6,
        "influenceRadiusMeters": 180
      }
    },
    {
      "id": "longgrass-plain",
      "role": "open gallop country with long-distance choice and returning sightlines",
      "anchorMeters": { "x": 310, "z": -120 },
      "coverage": 0.22,
      "elevationMeters": [10, 32],
      "moisture": [0.2, 0.6],
      "maxSlopeDegrees": 22,
      "adjacentTo": ["saltwind-coast", "fernwood", "blackstone-crown"],
      "tags": ["grassland", "gallop", "sightlines", "resting-circle"],
      "visualIntent": {
        "terrainFamily": "grassland",
        "silhouette": "lone tree and stone ridge below the central crown",
        "scatterFamilies": ["longgrass", "gorse", "field-boulder"],
        "scatterDensity": 0.5
      },
      "terrainIntent": {
        "anchorElevationMeters": 22,
        "influenceRadiusMeters": 230
      }
    },
    {
      "id": "fernwood",
      "role": "close woodland control, bark traces, and hidden reconnection routes",
      "anchorMeters": { "x": 275, "z": 220 },
      "coverage": 0.2,
      "elevationMeters": [16, 42],
      "moisture": [0.55, 1],
      "maxSlopeDegrees": 28,
      "adjacentTo": ["longgrass-plain", "river-hollow", "blackstone-crown"],
      "tags": ["forest", "ferns", "fallen-logs", "boundary-stones"],
      "visualIntent": {
        "terrainFamily": "woodland",
        "silhouette": "split cedar and ruined arch above a giant fern grove",
        "scatterFamilies": ["fern", "sapling", "moss-rock", "old-trunk"],
        "scatterDensity": 0.68
      },
      "terrainIntent": {
        "anchorElevationMeters": 32,
        "influenceRadiusMeters": 200
      }
    },
    {
      "id": "river-hollow",
      "role": "tranquil midpoint of fords, fresh tracks, springs, and safe rest",
      "anchorMeters": { "x": -260, "z": 220 },
      "coverage": 0.2,
      "elevationMeters": [5, 24],
      "moisture": [0.65, 1],
      "maxSlopeDegrees": 22,
      "adjacentTo": ["saltwind-coast", "fernwood", "blackstone-crown"],
      "tags": ["river", "ford", "waterfall", "spring", "mud"],
      "visualIntent": {
        "terrainFamily": "woodland",
        "silhouette": "waterfall notch, leaning stone bridge, and a bright spring",
        "scatterFamilies": ["river-stone", "reed", "willow", "moss-bank"],
        "scatterDensity": 0.58
      },
      "terrainIntent": {
        "anchorElevationMeters": 14,
        "influenceRadiusMeters": 210
      }
    },
    {
      "id": "blackstone-crown",
      "role": "broad central highland, two mastery approaches, and the living herd",
      "anchorMeters": { "x": 0, "z": 80 },
      "coverage": 0.2,
      "elevationMeters": [45, 80],
      "moisture": [0.15, 0.55],
      "maxSlopeDegrees": 28,
      "adjacentTo": ["longgrass-plain", "fernwood", "river-hollow"],
      "tags": ["basalt", "ridge", "saddle", "high-pasture", "herd"],
      "visualIntent": {
        "terrainFamily": "grassland",
        "silhouette": "broken black ridge framing a windswept summit saddle",
        "scatterFamilies": ["blackstone", "high-grass", "ridge-heather"],
        "scatterDensity": 0.4
      },
      "terrainIntent": {
        "anchorElevationMeters": 68,
        "influenceRadiusMeters": 230
      }
    }
  ],
  "requiredConnections": [
    {
      "id": "saltwind-longgrass-coastal",
      "fromRegionId": "saltwind-coast",
      "toRegionId": "longgrass-plain",
      "minimumWidthMeters": 9,
      "maximumSlopeDegrees": 16,
      "mandatory": true,
      "kind": "safe",
      "role": "coastal-loop",
      "viaMeters": [{ "x": 160, "z": -340 }, { "x": 285, "z": -250 }]
    },
    {
      "id": "longgrass-fernwood-coastal",
      "fromRegionId": "longgrass-plain",
      "toRegionId": "fernwood",
      "minimumWidthMeters": 8,
      "maximumSlopeDegrees": 18,
      "mandatory": true,
      "kind": "safe",
      "role": "coastal-loop",
      "viaMeters": [{ "x": 385, "z": -60 }, { "x": 380, "z": 120 }, { "x": 335, "z": 195 }]
    },
    {
      "id": "fernwood-river-coastal",
      "fromRegionId": "fernwood",
      "toRegionId": "river-hollow",
      "minimumWidthMeters": 7,
      "maximumSlopeDegrees": 18,
      "mandatory": true,
      "kind": "safe",
      "role": "coastal-loop",
      "viaMeters": [{ "x": 180, "z": 350 }, { "x": 0, "z": 390 }, { "x": -180, "z": 350 }]
    },
    {
      "id": "river-saltwind-coastal",
      "fromRegionId": "river-hollow",
      "toRegionId": "saltwind-coast",
      "minimumWidthMeters": 8,
      "maximumSlopeDegrees": 17,
      "mandatory": true,
      "kind": "safe",
      "role": "coastal-loop",
      "viaMeters": [{ "x": -350, "z": 120 }, { "x": -375, "z": -100 }, { "x": -250, "z": -290 }]
    },
    {
      "id": "river-blackstone-saddle",
      "fromRegionId": "river-hollow",
      "toRegionId": "blackstone-crown",
      "minimumWidthMeters": 7,
      "maximumSlopeDegrees": 24,
      "mandatory": true,
      "kind": "safe",
      "role": "regional-link",
      "viaMeters": [{ "x": -180, "z": 180 }, { "x": -90, "z": 130 }]
    },
    {
      "id": "longgrass-blackstone-ascent",
      "fromRegionId": "longgrass-plain",
      "toRegionId": "blackstone-crown",
      "minimumWidthMeters": 7,
      "maximumSlopeDegrees": 24,
      "mandatory": true,
      "kind": "safe",
      "role": "regional-link",
      "viaMeters": [{ "x": 220, "z": -30 }, { "x": 120, "z": 30 }]
    },
    {
      "id": "saltwind-longgrass-dune-cut",
      "fromRegionId": "saltwind-coast",
      "toRegionId": "longgrass-plain",
      "minimumWidthMeters": 4,
      "maximumSlopeDegrees": 24,
      "mandatory": false,
      "kind": "expressive",
      "role": "interior-shortcut",
      "viaMeters": [{ "x": 120, "z": -235 }, { "x": 230, "z": -170 }]
    },
    {
      "id": "longgrass-fernwood-ford-cut",
      "fromRegionId": "longgrass-plain",
      "toRegionId": "fernwood",
      "minimumWidthMeters": 4,
      "maximumSlopeDegrees": 26,
      "mandatory": false,
      "kind": "expressive",
      "role": "interior-shortcut",
      "viaMeters": [{ "x": 260, "z": 20 }, { "x": 235, "z": 125 }]
    },
    {
      "id": "fernwood-river-inner-trail",
      "fromRegionId": "fernwood",
      "toRegionId": "river-hollow",
      "minimumWidthMeters": 4,
      "maximumSlopeDegrees": 27,
      "mandatory": false,
      "kind": "expressive",
      "role": "interior-shortcut",
      "viaMeters": [{ "x": 130, "z": 230 }, { "x": -80, "z": 245 }]
    },
    {
      "id": "fernwood-blackstone-ridge",
      "fromRegionId": "fernwood",
      "toRegionId": "blackstone-crown",
      "minimumWidthMeters": 4,
      "maximumSlopeDegrees": 28,
      "mandatory": false,
      "kind": "expressive",
      "role": "interior-shortcut",
      "viaMeters": [{ "x": 180, "z": 180 }, { "x": 85, "z": 125 }]
    }
  ],
  "discoveries": [
    {
      "id": "storm-beach-hoofprints",
      "type": "herd-trace",
      "regionId": "saltwind-coast",
      "offsetFromRegionAnchorMeters": { "x": -70, "z": 20 },
      "mandatory": true,
      "journeyOrder": 10,
      "progression": {
        "prerequisiteIds": [],
        "reveal": { "kind": "proximity", "radiusMeters": 70 },
        "visitRadiusMeters": 12,
        "completion": { "kind": "interact", "interaction": "inspect" },
        "autosave": true
      },
      "signals": [
        { "kind": "tracks", "description": "deep hoofprints survive beside the storm tide line" },
        { "kind": "light", "description": "wet impressions catch the low sun" }
      ]
    },
    {
      "id": "longgrass-resting-circle-trace",
      "type": "herd-trace",
      "regionId": "longgrass-plain",
      "offsetFromRegionAnchorMeters": { "x": -80, "z": 50 },
      "mandatory": true,
      "journeyOrder": 20,
      "progression": {
        "prerequisiteIds": [],
        "reveal": { "kind": "proximity", "radiusMeters": 80 },
        "visitRadiusMeters": 15,
        "completion": { "kind": "linger", "ticks": 120 },
        "autosave": true
      },
      "signals": [
        { "kind": "tracks", "description": "a wide circle of flattened long grass" },
        { "kind": "motion", "description": "surrounding seed heads lean toward the old herd path" }
      ]
    },
    {
      "id": "fernwood-caught-hair",
      "type": "herd-trace",
      "regionId": "fernwood",